label,data_meta_ethnicity,data_meta_iep,data_meta_lep,data_meta_gender,data_meta_vendor_student_id,data_meta_student_grade,data_meta_student_test_id,data_answer,read_1_reader_id,read_2_reader_id,read_3_reader_id,read_4_reader_id,read_5_reader_id,read_1_score,read_2_score,read_3_score,read_4_score,read_5_score,read_1_condition_code,read_2_condition_code,read_3_condition_code,read_4_condition_code,read_5_condition_code
TRAINING,W,Y,N,F,8427374,4,10196823,I don't know,2225,65,,,,,,,,,I,I,,,
TRAINING,A,N,N,F,8427502,4,10196818,"I think porcupines have sharp, yellow, protective, strong teeth is because the teeth are the things that help them get food in the winter, for example, the porcupines need to eat bark and to tear bark their teeth have to be really strong.",93,148,,,,1,1,,,,,,,,
TRAINING,I,Y,Y,M,8427577,4,10196819,LKJHHGHHGGGFFFDDDDDDDDD JKHGFDDSSA LKJGHGGGGFS OPOPOP LKJH POIUYTOPOP YB V GVC C V LKJHGFDSAQWERRRRRRRRRRTTTTTTTTTTTTTTTTYYYYYYYYYYYYYYYUUUUUUUUUIIIIIIIOOOP[[[[[[[[[[]]]]]]]]]],2225,65,,,,,,,,,I,I,,,
TRAINING,W,N,N,M,8701610,4,10197003,They have the kind of teeth that we do because they chew food,2225,244,,,,0,0,,,,,,,,
TRAINING,I,N,N,F,9800805,4,10198133,Porcupines teeth are strong and hard and they never wear out also when they gnaw on wood it sharpens its teeth.,564,244,,,,1,1,,,,,,,,
TRAINING,I,N,Y,M,11495569,4,10198237,Excerpt from porcupines by diane swanson copyringht 2002 by gareth stevens publishing Reprinted by permission of gareth stevent Publishinig.,2225,244,,,716,,,,,,I,I,,,I
TRAINING,W,N,N,F,9804468,4,10198118,so they can build there homes.to chop dow trees.,65,71,,,,0,0,,,,,,,,
TRAINING,A,Y,N,M,10386094,4,10198194,because they need to chall.,564,2225,,,,0,0,,,,,,,,
TRAINING,W,N,N,M,10388799,4,10198171,they have these teeth to gnaw on trees.,2225,244,,,,0,0,,,,,,,,
TRAINING,W,N,N,M,10389893,4,10198169,I THINK THE NORTH AMERICAN EAT HORSES,564,2225,744,,,0,,,,,,I,I,,
TRAINING,H,N,Y,M,9351550,4,10198094,Its because their grow for its whole life they don t even wear out.In pargrath 6 in last sentence.,148,2225,,,,0,0,,,,,,,,
TRAINING,B,N,N,F,8710095,4,10196980,You should have cleen teeth two times a day.,2225,859,,,,0,0,,,,,,,,
TRAINING,W,N,N,M,342526,4,10194746,They gnaw off bark.,2225,244,,,,0,0,,,,,,,,
TRAINING,W,N,N,F,1744398,4,10196123,porcupines have all kinds of teeth some that kill their enemes soem that eat the barck off of a tree and some that help carry the twigs too make their home.,2225,65,,,,0,0,,,,,,,,
TRAINING,W,N,N,F,2319107,4,10196212,to help them eat.,2225,148,,,,0,0,,,,,,,,
TRAINING,W,N,N,M,8707445,4,10196859,They do so they can gnaw wood.,2225,148,,,,0,0,,,,,,,,
TRAINING,W,N,N,F,2215648,4,10196251,Porcupines have the kind of teeth they do because there is use for all of their teeth. In the Summer months they use their back teeth to eat fruits and other things. In the winter months they use their front teeth to peel off the bark on trees.,2225,859,,,,1,1,,,,,,,,
TRAINING,W,N,N,F,667498,4,10195635,mabye because not all porcipines have teeth,93,148,,,,0,0,,,,,,,,
TRAINING,I,N,N,F,1173805,4,10196072,They have the teeth that they have because they are porcupines and they need teeth to get food.,2225,71,,,,0,0,,,,,,,,
TRAINING,H,N,N,M,1746063,4,10196115,A porcupines teeth is like mices teeth.,124,148,,,,0,0,,,,,,,,
TRAINING,W,N,N,F,8706439,4,10196868,"An easy inference I can make about porcupine teeth is that there aunts and uncles are bevers.I say that becuse in World Full of Food,it says that its easy for a porcupines to gnaw on wood.",124,71,,,,0,0,,,,,,,,
TRAINING,H,N,N,M,343666,4,10194767,they have teeth beacaus so they can hunt,2225,244,,,,0,0,,,,,,,,
TRAINING,W,N,N,F,343704,4,10194777,that they get sheep's wool,93,2225,,,,0,0,,,,,,,,
TRAINING,W,N,N,M,343794,4,10194780,porcupines have the teeth they do so they can alert predatrors,124,2225,,,,0,0,,,,,,,,
TRAINING,H,Y,Y,F,450816,4,10195192,"the longest hairs in the coat are called guard hairs,which help the porcupine shed rain. they look like thin quills are special hairs with sharp,pointed end.most of the time,the quills are hidden dy the guard hairs. beneath the poprcupine's tail, the quill hairs are shot and stiff, like bristles on a brush.",2225,148,,,,0,0,,,,,,,,
TRAINING,H,N,N,F,9350142,4,10198082,Porcupines have the kind of teeth that they do because they need to use them to scrape off bark then eat the tender part of it. the four front teeth are built for especially gnawing.they are sharp and strong.,93,564,,,,1,1,,,,,,,,
TRAINING,H,N,N,M,8707774,4,10196930,Porkie pines can send a warning to the enemy to not atack him/her beacause they can stike a needle also they can play dead.,2225,65,,,,0,0,,,,,,,,
TRAINING,W,N,N,M,8708010,4,10196940,I think why they have the kind of teeth that they have is because they could scare away a enimy with them for exsample it says in the pasage &quot;It shivers all over then lightly closes its jaws. That makes the top and bottom teeth c-l-a-t-t-e-r together. The sound is soft but scary.,2225,148,,,,1,1,,,,,,,,
TRAINING,H,N,N,M,3938274,4,10196298,Porcupines have teeth like they do becouse they eat wood or bark &amp; stuff lile that so they have to have teeth like that so they can gnaw on the wood just like beavers.,65,859,,,,1,1,,,,,,,,
TRAINING,H,N,N,F,3946208,4,10196273,to gnaw food,2225,65,,,,0,0,,,,,,,,
TRAINING,H,N,N,M,3946213,4,10196272,The porcupines have the kind of teeth that they do because they can chop the tree wood.,2225,65,,,,0,0,,,,,,,,
TRAINING,H,N,N,M,6478192,4,10196681,north american are in the wore rit now.,564,2225,,,,0,0,,,,,,,,
TRAINING,NR,N,N,M,9803209,4,10198128,I DONT NO,2225,244,,,,,,,,,I,I,,,
TRAINING,H,N,Y,M,5420363,4,10196363,Animals with four front teeth built especially for gnawing,2225,71,,,,0,0,,,,,,,,
TRAINING,W,N,N,F,5419831,4,10196423,Porqupine's teeth help them eat bark off of the tree's they also help them knaw on things to keep there teeth nice and strong.There teeth are very fastenating they do so much with a porqupine's life and help's them do all sort's of things.There teeth are one of there main thing's on there body.,244,148,,,,2,2,,,,,,,,
TRAINING,B,N,N,M,5420717,4,10196421,"There are reason that porcupines have the kind of teeth that they do is because on world full of food it states that ''its easy to knaw wood.with porcupine teeth'' so that means they have sharp teeth to eat hard food like apples,pears,and other foods.The last reason that porcupines need there sharp teeth is because during winter,porcupines use their big front teeth to scrape off bark.then they eat the tender woody parts of shrubs and trees and that is two resons that porcupines need the teeth that they have.",2225,148,,,,2,2,,,,,,,,
TRAINING,H,Y,Y,F,5655800,4,10196530,"North American porcupines are the second largest rodentson the continent . They're at least as a pail of ice -cream,but some weigh much more.",2225,244,729,,,0,1,0,,,,,,,
TRAINING,H,N,Y,F,5655843,4,10196532,World of Difference is about were there is difference about opther world.You can go where every you want in the world. The world is a good you can go any where.,244,2225,,,,,,,,,I,I,,,
TRAINING,W,N,N,F,5657042,4,10196526,In the wenter porcupines use ther huge front theeth to wipe off bark.Then they eat the worme tender body parts.,564,2225,,,,0,0,,,,,,,,
TRAINING,B,N,N,F,7498424,4,10196844,The teeth were sharp and pointy.,2225,244,,,,0,0,,,,,,,,
TRAINING,H,N,Y,F,8426620,4,10196796,Porcupines have kind of theeth beacause when a bigger creature is actacing it the proabiy use thre theeth and spikes for portction.,2225,244,,,,0,0,,,,,,,,
TRAINING,H,N,Y,F,8427204,4,10196798,"The porcupines uses a set of flatter teeth, called cheek teeth, to grind up food. A gap between these teeth and the animal's big chompers lets it tuck its lips behind its front teeth. This keeps bark chips and frosty winter air out of the porcupine's mouth.",93,2225,,,,0,0,,,,,,,,
TRAINING,W,N,N,F,11062852,4,10198181,"Porcupines have very strong teeth. In the passage it states &quot;Its easy to gnaw wood with porcipine teeth. The front pairs top and bottom are strong and sharp.&quot; During seasons there teeth are very useful.The text says &quot; During winter use thier big front teeth to scrape off bark. Then they eat the tender woody parts of shrubs and trees.&quot; It also says, &quot;In warmer months, porcupines snif off twigs and eat new buds and leaves. The munch on fruit especially apples!&quot;",156,2225,,,,2,2,,,,,,,,
TRAINING,W,N,N,M,664965,4,10195544,The porcupines teeth never stop growing they are like rats teeth never stop growing.,2225,148,744,,,0,1,0,,,,,,,
TRAINING,W,N,N,F,8702352,4,10198057,"They need their teeth to eat also, to scare off preditors.",124,148,,,,0,0,,,,,,,,
TRAINING,I,N,N,M,7494943,4,10196726,"prickly porcupines wear quill- filled coats. no wonder they'er called pricklepigs quillpigs, and quillers",2225,65,,,,0,0,,,,,,,,
TRAINING,W,N,N,M,10700122,4,10198202,a porcupine teeth are like that so they can scare off enemies.,2225,148,,,,0,0,,,,,,,,
TRAINING,W,N,N,M,10704532,4,10198157,they have big chomping teeth that they use to rip bark off of tree's.,148,2225,729,,,1,0,0,,,,,,,
TRAINING,W,N,N,F,11061777,4,10198175,"Porcupine have teeth the way they do because the need them for eating. It said in the passage, during winter porcupines ise their big front teeth to scrape off bark. Then they eat the tender woody parts.",564,65,,,,1,1,,,,,,,,
TRAINING,W,N,N,M,12149950,4,10198341,"I think porcupines have those sharp teeth to chip bark off the trees for a snack in the winter, because it is pretty hard to find yummy plants in the winter. Also bark has a lot of good stuff in it.",2225,148,,,,1,1,,,,,,,,
TRAINING,H,N,Y,F,11670900,4,10198272,DONT NO,2225,148,,,,,,,,,I,I,,,
TRAINING,W,N,N,F,11524689,4,10198260,There teeth can be used for eating wood or eating twiges.,2225,244,,,,0,0,,,,,,,,
TRAINING,W,N,N,F,11527542,4,10198236,df d6de,65,2225,,,,,,,,,I,I,,,
TRAINING,W,N,N,F,11824939,4,10198283,Because the beavers need to chop branches and trees down so they can make a dam to live in we they need homes to and they need to eat to most beavers dont like to eat wood but its a hobby beavers are just like us because they need to eat and they need someone to love them and they need homes they need tostay alive for their familes to.,156,2225,744,,716,0,,0,,0,,I,,,
TRAINING,W,N,N,M,12063274,4,10198329,the porcupines have big teeth to knaw on hard stuff like wood,2225,244,,,,0,0,,,,,,,,
TRAINING,W,N,N,F,11970063,4,10198312,"I think porcupines have those kind of teeth so they can make their ''home'' and to scare other animals. They shiver all over, then lightly close their jaw. That makes its top and bottom teeth c-l-a-t-t-e-r together. The sound is soft, but scary, lasting up to thirty seconds at a time. If necessary, the porcupine repeats again and again.",2225,65,,,,1,1,,,,,,,,
TRAINING,W,N,N,F,11970067,4,10198316,i would geusthe porcupines have very sharp teeth so they can get food easily,2225,65,,,,0,0,,,,,,,,
TRAINING,W,N,N,F,11970103,4,10198311,thay help naw.,2225,65,,,,0,0,,,,,,,,
TRAINING,W,N,N,F,12178752,4,10198350,porcupines have the teeth they do to gnaw wood and find food.they also use them as a warning by chattering them together.,2225,65,,,,1,1,,,,,,,,
TRAINING,W,N,N,F,11970218,4,10198315,"Well the porky-pine has big teath for a mater of resons. The one I thought to be the most interesting though was as a warning that you where bugging or scarying the animal. Just like beaver and squirles thouggh the porky-pines like to naw on trees twigs and most likley their pray, or should I say food. Because I'de be suprized if the ate grass and grass only. Espacially with the fact that the are the second to largest animal on the continet.",859,2225,,,,1,1,,,,,,,,
TRAINING,W,N,N,M,12178754,4,10198349,Porcupines have the teeth that way because in the winter and summer they need to be able to get food and eat and idealy they wouldn't survive thta long if they had them.,2225,71,,,,1,1,,,,,,,,
TRAINING,W,N,N,M,12149640,4,10198335,So porcupines can eat hard food.,564,2225,,,,0,0,,,,,,,,
TRAINING,H,N,Y,M,12018389,4,10198309,much on wood.,564,148,,,,0,0,,,,,,,,
TRAINING,W,N,Y,F,11971523,4,10198320,there teeth are actually pretty sharp.,2225,244,,,,0,0,,,,,,,,
TRAINING,W,N,N,F,12106180,4,10198332,porcupines have strong sharp teeth so that the can chew wood and other things thier teeth keep on growiing so they never wear out,564,93,,,,1,1,,,,,,,,
TRAINING,W,N,N,F,12194686,4,10198347,Porcupines have the type they do so they chew on nuts.,2225,65,,,,0,0,,,,,,,,
TRAINING,W,N,N,M,12218422,4,10198352,"What inference made about why have the kind teeth that they do? The answer is, tooth brush",2225,148,,,,0,0,,,,,,,,
TRAINING,B,N,N,F,450070,4,10195155,THEY HAVE THOES KIND OF TEETH FOR GNAWING AND BULIDING HOMES,244,2225,,,,0,0,,,,,,,,
TRAINING,W,N,N,M,449489,4,10195161,To chew bark to eat softer foods.,65,2225,,,,0,0,,,,,,,,
TRAINING,W,N,N,M,449494,4,10195158,"So they can find food,eat food, and get preadators away from thier families for defense. It also helps them get past harsh winters.",93,2225,,,,0,0,,,,,,,,
TRAINING,W,N,N,M,540939,4,10195403,Porcupines have 4 sharp teeth so they can eat hard foods.,564,2225,729,,,1,0,0,,,,,,,
TRAINING,W,Y,N,F,540941,4,10195406,The longest hairs in the cost are called guard hairs which help the porcupine sined rain.,2225,244,,,,0,0,,,,,,,,
TRAINING,W,N,N,M,1176174,4,10195849,They take care of them self.,2225,244,744,,716,,0,0,,0,I,,,,
TRAINING,B,N,N,M,1176215,4,10195850,it's teeth helps it by bark chips-and frosty winter air out of the porcupine's mouth.,2225,244,,,,0,0,,,,,,,,
TRAINING,I,Y,N,M,99476,4,10195088,They have them built in especially for gnawing.,71,65,,,,0,0,,,,,,,,
TRAINING,H,N,N,M,99479,4,10195091,they us it for gnwing on stuff,2225,244,,,,0,0,,,,,,,,
TRAINING,W,N,N,F,100040,4,10195094,I would never have big teeth it would fell weird too me i think,2225,148,,,,0,0,,,,,,,,
TRAINING,I,N,N,F,100307,4,10195100,Porcupines use they're teeth two naw on stuff.Z,65,2225,,,,0,0,,,,,,,,
TRAINING,I,Y,N,F,100182,4,10195106,the is about prickly,2225,244,,,,0,0,,,,,,,,
TRAINING,I,N,Y,M,100234,4,10195115,by brushing hes teeth lot of times,2225,244,729,,716,0,,0,,,,I,,,I
TRAINING,I,N,N,F,211900,4,10194938,The porcupine has the teeth it has because the porcupine can't eat its food with out it teeth it has.,244,2225,729,,,1,0,0,,,,,,,
TRAINING,W,N,N,F,212478,4,10194967,Porcupines teeth are strong. My prufe is from the text.The front pairs-top and bottom-are strong and sharp.,2225,148,744,,,0,1,0,,,,,,,
TRAINING,I,N,N,M,212220,4,10194973,"porcupine have no teeth and they have sharp quils, if you go to close to the porcipine he will strike",71,2225,,,,0,0,,,,,,,,
TRAINING,I,N,N,F,212360,4,10194976,the front pairs top and bottom are strong and sharp and also the use thier teeth for scraping off bark.,65,2225,,,,1,1,,,,,,,,
TRAINING,I,N,N,F,212593,4,10194982,The porcupine uses a set of flatter teeth called cheek teeth to grund up food,2225,65,,,,0,0,,,,,,,,
TRAINING,I,N,N,M,211983,4,10194983,than hvae sorp teda,564,2225,729,,,,0,0,,,I,,,,
TRAINING,I,N,N,F,2751930,4,10196258,porcupines have sharp teeth cause they gnawing at people,2225,148,,,,0,0,,,,,,,,
TRAINING,I,N,N,F,2317523,4,10196215,Why do porciquines have spikes?,2225,859,,,,0,0,,,,,,,,
TRAINING,I,N,N,M,212682,4,10194986,I have no idea,93,2225,,,,,,,,,I,I,,,
TRAINING,W,N,N,F,538953,4,10195224,They use them to make sound and to send warnings.,2225,859,,,,0,0,,,,,,,,
TRAINING,I,N,N,F,343167,4,10194757,"Porcupines have the kind of teeth they do because, they need it to get there food.",2225,71,,,,0,0,,,,,,,,
TRAINING,I,N,N,F,343158,4,10194764,To gnaw on stuff and scrap off bark and to warn so they don't have to shoot there quills.,2225,859,729,,,0,1,0,,,,,,,
TRAINING,NR,N,N,F,452385,4,10194808,Porqupines have teeth to help them eat.,564,124,,,,0,0,,,,,,,,
TRAINING,I,N,Y,F,452154,4,10194814,idk am srry idk wat to write,2225,65,,,,,,,,,I,I,,,
TRAINING,W,N,N,F,452763,4,10194832,becouse there built for knawing,2225,65,,,,0,0,,,,,,,,
TRAINING,B,N,N,M,539428,4,10195254,to help them eat there food. And they use there back teeth to keep there mouth worm.,65,2225,729,,,0,1,0,,,,,,,
TRAINING,H,N,N,M,539430,4,10195257,They can c-l-a-t-t-e-r it. The sound is scary and soft.,564,156,,,,0,0,,,,,,,,
TRAINING,W,N,N,M,539319,4,10195240,The reason why porcupines have long teeth is because they need them to eat bark.,2225,859,729,,,0,1,1,,,,,,,
TRAINING,W,N,N,F,662397,4,10195538,"I can gess that they have sharp teeth. The reason I can gess that they have sharp teeth , is because when they gnaw on wood sharpens their teeth.",2225,65,,,,1,1,,,,,,,,
TRAINING,W,N,N,F,539981,4,10195242,To get food from the trees and wood to eat and knaw on.,2225,859,,,,0,0,,,,,,,,
TRAINING,A,N,Y,M,540503,4,10195283,It was no wonder they're pricklepigs.,2225,65,729,,716,0,,,,0,,I,I,,
TRAINING,H,N,N,F,540032,4,10195277,They have the teeth they have because they are rodans and to gnaw easy with there teeth.,564,65,,,,0,0,,,,,,,,
TRAINING,H,Y,Y,M,540079,4,10195280,it is ok.,2225,244,,,,,,,,,I,I,,,
TRAINING,W,N,N,F,1030024,4,10195776,they use there teeth to make noises and they take bark off of trees and they eat the bark and in the summer they eat apples but not the middle.,2225,148,729,,,0,1,0,,,,,,,
TRAINING,W,N,N,M,539962,4,10195302,They can worn off enimeis,2225,65,,,,0,0,,,,,,,,
TRAINING,W,N,N,M,540122,4,10195298,So they can bite wood.,65,2225,,,,0,0,,,,,,,,
TRAINING,B,N,N,M,540374,4,10195291,Porcupines use their teeth to eat.,244,65,,,,0,0,,,,,,,,
TRAINING,W,N,N,M,541008,4,10195397,porcupines must have to use their quills a lot to defend themselves.,564,148,,,,0,0,,,,,,,,
TRAINING,W,N,N,F,710892,4,10195701,"they are strong and sharp so they can cut a lot of things,",2225,65,,,,0,0,,,,,,,,
TRAINING,H,N,Y,F,711205,4,10195707,"to tell that the women used to make cloth. but people called pricklepigs and quillpigs,quillers",2225,244,,,,0,0,,,,,,,,
TRAINING,W,N,N,F,711507,4,10195679,I think that porcupine have teeth like they do because it helps them gnaw through wood.,65,2225,,,,0,0,,,,,,,,
TRAINING,H,N,N,M,710981,4,10195676,its easy to gnaw wood with porcupine teeth.The front pair- top and bottom-are strong and sharp.,564,65,744,,,1,0,0,,,,,,,
TRAINING,W,N,N,F,663995,4,10195517,Porcupines teeth are like beaver teeth there teeth just keep on growing.During winter they use their big front teeth too scrape off bark.They eat the tender woody parts of shrubs and trees.,2225,65,,,,1,1,,,,,,,,
TRAINING,W,N,N,F,711985,4,10195683,Well the story toled me that he has very big teeht.,2225,148,,,,0,0,,,,,,,,
TRAINING,W,N,N,F,664443,4,10195456,they have that kind of teeth so they can enimes and eat,859,2225,,,,0,0,,,,,,,,
TRAINING,I,Y,N,M,712684,4,10195687,tell thay can defend them selfs.,65,2225,,,,0,0,,,,,,,,
TRAINING,I,N,N,F,665353,4,10195481,"Gnaw on wood,when it gnaw they get sharp and strong.",2225,859,729,,,1,0,0,,,,,,,
TRAINING,W,Y,N,F,665356,4,10195484,"Excerpt from Porcupines by Diane Swanson. Sitting up on its hind leges and it,s tial,the porcupine can use its front paws and claws to hold food wile it aets.",2225,65,729,,716,0,,0,,0,,I,,,
TRAINING,W,N,N,F,665519,4,10195554,The porcupine has sharp teeth so it can bite something and it won't matter because its teeth grows its whole life.,859,2225,,,,1,1,,,,,,,,
TRAINING,W,Y,N,F,664925,4,10195545,so they can scare off the enemy.,2225,65,,,,0,0,,,,,,,,
TRAINING,H,Y,N,M,666010,4,10195606,Porcupines have the teeth that thay need to bite off tree bark and eat the bark and there teeth never wear out also the teeth can grow for a life time,564,2225,,,,1,1,,,,,,,,
TRAINING,W,N,N,M,665696,4,10195603,they have sharp teeth and dull teeth,2225,65,,,,0,0,,,,,,,,
TRAINING,B,N,N,M,666569,4,10195617,they have special teeth to gnaw wood and crackle them to warn animals the stay away,2225,65,,,,0,0,,,,,,,,
TRAINING,I,N,N,F,1030872,4,10195819,thay have spikes on there backs so if something trys to attack it will stick its spikes out and save its self from getting attacked FROM other creachers,148,2225,,,,0,0,,,,,,,,
TRAINING,I,Y,Y,F,1173982,4,10196059,if you are french you would call the porcupines spiny pigs the are not like other animals like mice squrrels beavers.,2225,148,,,,0,0,,,,,,,,
TRAINING,I,N,N,F,666310,4,10195644,good job,2225,244,,,,,,,,,I,I,,,
TRAINING,H,N,N,M,1173845,4,10196081,"my inference have the kind of teeth they do is in passage 2, they need it to scrape off bark to get the soft part in the tree which they eat. In passage 3 porcupines clatter there teeth together to warn the enemy.",2225,859,,,,1,1,,,,,,,,
TRAINING,W,N,N,M,1032629,4,10195799,They use thier teeth for munching on food like bark or blossomes.,2225,65,,,,0,0,,,,,,,,
TRAINING,H,N,N,F,1032753,4,10195823,they have alot of teeth,124,148,,,,0,0,,,,,,,,
TRAINING,W,N,N,F,1033522,4,10195834,"Porcupines use there teeth to scrap off bark, or they use there teeth for nibbling needles on evergreen trees.",2225,148,,,,0,0,,,,,,,,
TRAINING,W,Y,N,F,1033815,4,10195832,SO THEY CAN KEEP THERE TEETH TRIMED TO HELP THERE TEETH SO THEY DONT LOOSE THERE TEETH OUR HURT THERE TEETH.,2225,65,,,,0,0,,,,,,,,
TRAINING,H,N,Y,M,1033405,4,10195830,They like to paly,564,65,,,,0,0,,,,,,,,
TRAINING,W,N,N,M,1175251,4,10196084,they are tough so they would probaly not break,124,93,,,,0,0,,,,,,,,
TRAINING,W,N,N,F,1175796,4,10196061,"I infer there teeth grow because, it might chip a tooth, and if ther teeth didn't grow that tooth wood be short.",2225,65,729,,,0,1,0,,,,,,,
TRAINING,A,N,N,M,1175916,4,10196067,I infer they have teeth like that because they need it to eat food and to gnaw wood.,564,148,,,,0,0,,,,,,,,
TRAINING,W,N,N,F,1175362,4,10196065,In the passage it states that the porcupine has those teeth because it helps the porcupine eat and deffend it's self.,2225,859,729,,,0,1,0,,,,,,,
TRAINING,W,N,N,M,1177077,4,10195854,The inference that there teeth make is the front four teeth make is that they can use them when animales attcking them.,124,2225,,,,0,0,,,,,,,,
TRAINING,W,N,N,M,1176772,4,10195853,they eat there food and tell the predator to beware.,2225,65,,,,0,0,,,,,,,,
TRAINING,W,N,N,M,1176860,4,10195856,To chew on wood and other things.,2225,148,,,,0,0,,,,,,,,
TRAINING,B,N,N,F,1177020,4,10195857,so it is easy to gnaw wood and chew,564,148,,,,0,0,,,,,,,,
TRAINING,W,N,N,M,1397170,4,10195920,To clatter their teeth to make a soung to warn their predators that they are dangerous.,148,2225,729,,,0,1,0,,,,,,,
TRAINING,W,N,N,M,1397065,4,10195918,They use there flat teeth to grind up food.,2225,65,,,,0,0,,,,,,,,
TRAINING,I,N,N,M,1178166,4,10195863,POBULSHERS SHOOT THARA GLSORY,564,2225,,,,,,,,,I,I,,,
TRAINING,W,N,N,F,1178738,4,10195876,They have the teeth they have because it is more easy to gnaw on wood.,2225,148,,,,0,0,,,,,,,,
TRAINING,H,N,Y,F,1397837,4,10195938,porcupines have shorp teeth that they can rip a srong tree prach,2225,148,,,,0,0,,,,,,,,
TRAINING,I,N,N,M,1398077,4,10195936,the quills protect them.,2225,244,,,,0,0,,,,,,,,
TRAINING,I,N,N,F,1398607,4,10195940,So they can chew on bark and eat things thta are hard to for other animals.they also knaw on wood.beacause the teeth grow all their life they never ever ever wear out!,564,71,729,,,0,1,0,,,,,,,
TRAINING,H,N,N,M,1398734,4,10196004,porcupines have very sharp teeth,2225,244,,,,0,0,,,,,,,,
TRAINING,W,N,N,M,1398216,4,10195999,"The porcupine uses a set of flatter teeth,called cheek teeth,to grind up food.A gap between these teeth and the animal's big chompers lets it tuck its lips behind its front teeth.This keeps bark chips-and frosty winter air-out of the porcupine's mouth.",65,2225,,,,0,0,,,,,,,,
TRAINING,W,N,N,F,1398260,4,10196002,they can use there teeth to warn enemes.,2225,859,,,,0,0,,,,,,,,
TRAINING,A,N,N,F,1398416,4,10196006,"to eat, to warn ,and look scrary",2225,71,,,,0,0,,,,,,,,
TRAINING,I,N,N,M,1746014,4,10196136,"It's easy to gnaw wood, with porcupine teeth",148,2225,,,,0,0,,,,,,,,
TRAINING,W,N,N,M,1398235,4,10196008,They have thos theeth cas thar spechal...,156,2225,,,,0,0,,,,,,,,
TRAINING,H,N,N,F,2010328,4,10196203,(:Porcupines have four teeth built especially for gnawing.,564,2225,,,,0,0,,,,,,,,
TRAINING,W,N,N,F,1745436,4,10196145,They have those teeth to chew plants and to to make a warning call.,564,93,,,,0,0,,,,,,,,
TRAINING,I,N,Y,F,3933224,4,10196288,DURING WINTER PORCUPINES USE THERE BIG FRONT TEETH TO SCRAP OFF BARK THEN THEY EAT THE TENDER WOODY PARTS OF SHRUBS AND TREES THEY ALSO NIBBLE NEEDLES ON EVERGREENS.,2225,65,729,,,1,0,0,,,,,,,
TRAINING,W,N,N,M,2752098,4,10196256,That they eat hared things.,124,564,,,,0,0,,,,,,,,
TRAINING,I,N,N,F,1398481,4,10196012,there for gnawing on.,564,2225,,,,0,0,,,,,,,,
TRAINING,I,N,N,M,1398484,4,10196016,Because some creatures have to have more than 2 features,2225,244,,,,,,,,,I,I,,,
TRAINING,H,N,N,F,1745790,4,10196146,They have that kind of orange color of teeth because that is a layer of protection for the porcupines teeth.,564,148,,,,0,0,,,,,,,,
TRAINING,H,N,N,F,1398287,4,10196010,so they can get or yous it for something.,156,148,,,,0,0,,,,,,,,
TRAINING,W,N,N,M,1398367,4,10196014,So they can cut down trees and branches so they can make homes or get food for thier young.,2225,244,,,,0,0,,,,,,,,
TRAINING,H,N,N,F,1399392,4,10196018,Porcupines have a cupel sharp teeth like humens. porcupines can shed and hide from other peple porcupines have nedles on ther back because thay can defend them self when a anamail is tring to attack it.,2225,71,729,,,0,1,0,,,,,,,
TRAINING,I,N,Y,F,1399202,4,10196020,i need more learning to answer this,564,244,,,,,,,,,I,I,,,
TRAINING,W,N,N,F,1745695,4,10196111,They us them to naw wood and fite!,2225,65,,,,0,0,,,,,,,,
