label,data_meta_ethnicity,data_meta_iep,data_meta_lep,data_meta_gender,data_meta_vendor_student_id,data_meta_student_grade,data_meta_student_test_id,data_answer,read_1_reader_id,read_2_reader_id,read_3_reader_id,read_4_reader_id,read_5_reader_id,read_1_score,read_2_score,read_3_score,read_4_score,read_5_score,read_1_condition_code,read_2_condition_code,read_3_condition_code,read_4_condition_code,read_5_condition_code
TRAINING,NR,N,N,M,10389745,4,10198170,thay have 4 teeath that are orange,2225,148,,,,0,0,,,,,,,,
TRAINING,W,N,N,M,10389460,4,10198168,because when they chew on bark off of trees it sharpens there teeth and they grow for as long as they live.,2225,244,,,,1,1,,,,,,,,
TRAINING,NR,Y,N,F,10389493,4,10198172,"As the porcupine gnaws, it sharpens these teeth by wearing away the backs faster than the fronts.",2225,244,,,,0,0,,,,,,,,
TRAINING,W,N,N,F,10703428,4,10198163,I think that they have there teeth because they are strong the grow over the porcupines whole life and it helps portect its self.,2225,244,,,,1,1,,,,,,,,
TRAINING,H,Y,N,M,10703632,4,10198159,to gnaw food.,2225,65,,,,0,0,,,,,,,,
TRAINING,A,N,N,F,10704074,4,10198160,"I think the porcupines have that kind of teeth because it's easy to gnaw food with the teeth they have. In the passage, it says that the porcupines eat tendery woody parts of shrub and trees. I think they need strong teeth to scrape off bark on the trees.",2225,859,729,,,1,2,2,,,,,,,
TRAINING,W,N,N,M,10703849,4,10198158,They have thoughs kind of theeth to gring on food and the teeth are made so they can keep bark chips and frosty winter air out of there mouth.,2225,148,,,,1,1,,,,,,,,
TRAINING,H,N,Y,F,11970041,4,10198324,the porcupines thire top bottome teeth c-l-a-t-t-e-r together.,2225,71,,,,0,0,,,,,,,,
TRAINING,H,N,N,F,11062500,4,10198180,"An animal with thin,sharp parts covering its body.",2225,65,,,,0,0,,,,,,,,
TRAINING,H,N,N,F,11738886,4,10198264,they might have teath like that because they probbley use them when they eat or when they fight with other animals.,564,2225,,,,0,0,,,,,,,,
TRAINING,H,N,Y,F,11269522,4,10198221,That maybe because everything has to be just.But sometimes it's good to be different.,2225,148,,,,0,0,,,,,,,,
TRAINING,H,N,Y,M,11270579,4,10198218,It is easy to gnaw wood with porcupine teeth .,564,156,,,,0,0,,,,,,,,
TRAINING,H,N,N,M,11270069,4,10198213,BECUASE THE SPIKES SCER AWAY THER PRETERDS.,2225,148,,,,0,0,,,,,,,,
TRAINING,W,N,N,F,11270340,4,10198214,they have the teeth that they do so that they can chew wood and make warning noises,2225,244,,,,0,0,,,,,,,,
TRAINING,W,N,N,M,11270767,4,10198216,They have the kind of teeth that they do to chew on bark and to scare away predators.,2225,244,729,,,0,1,1,,,,,,,
TRAINING,H,N,Y,M,11270695,4,10198215,OP,2225,244,,,,,,,,,I,I,,,
TRAINING,W,Y,N,M,11271098,4,10198217,porcupins are animals with pokes on them.,156,65,,,,0,0,,,,,,,,
TRAINING,H,N,Y,M,11670934,4,10198271,porcupines teeth or for chowing on stuf,859,2225,,,,0,0,,,,,,,,
TRAINING,H,N,N,F,11271567,4,10198205,they probably have 4 front teeth for gnawing. the top and bottom pairs are strong and sharp. they have 2 coatinges one orange protecting the outer surface.,2225,859,729,,,0,1,0,,,,,,,
TRAINING,W,Y,N,M,11524697,4,10198261,they yuse thier teeth to cut open trees and eat the bark. they also make a nois with their teeth to worn enamys.,564,244,,,,0,0,,,,,,,,
TRAINING,W,N,N,F,11526422,4,10198249,They have that kind of teeth to warn the human or animal. How they do it is by clattering their teeth together.,156,124,,,,1,1,,,,,,,,
TRAINING,W,Y,N,M,11526150,4,10198228,now wonder they colod hem picls.,71,2225,729,,,0,,0,,,,I,,,
TRAINING,H,N,Y,F,11526158,4,10198234,they make diferent caind of teeth.,244,2225,,,,0,0,,,,,,,,
TRAINING,W,N,N,F,11526233,4,10198235,because they need to eat so they need there teeth.,65,2225,,,,0,0,,,,,,,,
TRAINING,W,N,N,F,11526907,4,10198229,they move there teeth up and down realy fast so it sounds scary but soft.,2225,148,,,,0,0,,,,,,,,
TRAINING,H,N,N,F,11527103,4,10198231,they use theretop and bottom teeth sothey can sharpend an orange.,2225,244,,,,0,0,,,,,,,,
TRAINING,A,N,Y,M,11526618,4,10198232,to grind food.A gap betwwen these teeth and animal's big chomper lets it tuck its lips behind its front teeth.,2225,244,,,,0,0,,,,,,,,
TRAINING,W,Y,N,M,11969850,4,10198313,porcupinenes have four front teeth for gnawing,244,2225,,,,0,0,,,,,,,,
TRAINING,H,N,Y,F,11527987,4,10198227,a gap between these teeth and the animals,2225,244,,,,0,0,,,,,,,,
TRAINING,W,N,N,F,11824889,4,10198282,"There teeth are sharp to top to bottom. A tough orange coating protects their outer surface. As the porcupine gnaws, it sharpens these teeth by wearing away the backs faster than the fronts.Because the teeth grow for its whole life,they dont ever wear out.",2225,148,,,,1,1,,,,,,,,
TRAINING,W,N,N,M,11528060,4,10198226,the reason they have special teeth is too eat leaves bark and wood with without getting hurt,2225,148,,,,0,0,,,,,,,,
TRAINING,W,N,N,F,11497977,4,10198244,So they can talk to the preditor giving it warning's to get out of here.,2225,859,,,,0,0,,,,,,,,
TRAINING,W,N,N,F,11498428,4,10198247,If that dosent work the porcupine tries warning with sound. It shivers all over then lightly closes its jaws. That makes its top and bottom teeth clatter together. The sound is soft but scary lasting up to thirty seconds at a time. If necessary the porcupine repeats it again and again.,2225,244,,,,0,0,,,,,,,,
TRAINING,B,N,N,F,11498392,4,10198245,"In the text it says'' As the porcupine knaws, it sharpens these teeth by wearing away the backs faster than the fronts. Because the teeth grow for it's whole life, they don't ever wear out. During winter, porcupines use their big front teeth to scrape off bark.",2225,65,,,,0,0,,,,,,,,
TRAINING,NR,N,N,M,11498220,4,10198246,?,2225,148,,,,,,,,,I,I,,,
TRAINING,H,N,N,F,11672506,4,10198276,Porcupines have the teeth they do because they need to knaw at things such as bark or lilypads or anything it needs to eat.If porcupines didn't have the teeth they have now they wouldn't be able to survive.,859,2225,729,,,2,1,1,,,,,,,
TRAINING,W,N,N,F,11672347,4,10198278,"to chew or bit down in,or, on something!",2225,859,,,,0,0,,,,,,,,
TRAINING,W,N,N,M,11673461,4,10198279,"First they are rodents, next they eat wood and that means that they are like beavers. They use their teeth to eat wood and scare off hunters.",2225,65,729,,,1,2,0,,,,,,,
TRAINING,W,Y,N,M,11673013,4,10198277,they yous them for pertecshon,93,148,,,,0,0,,,,,,,,
TRAINING,H,N,Y,M,11825443,4,10198291,THEY talk a bit when they're looking for mates and caring for their young.,2225,65,729,,716,0,,0,,0,,I,,,
TRAINING,W,N,N,M,11825983,4,10198290,they have 4 teeth to nibble with because it is a rodent.,93,65,744,,,0,1,1,,,,,,,
TRAINING,W,N,N,M,11825950,4,10198293,this is practi_ _ _,2225,65,,,,,,,,,I,I,,,
TRAINING,NR,N,N,F,11826072,4,10198289,"The inference can be made because it is easy to gnaw on wood, the front pairs top and bottom are strong and sharp.",2225,244,,,,1,1,,,,,,,,
TRAINING,W,Y,N,M,11825802,4,10198296,kids might be dieing witch is a bad thing,156,148,744,,,,0,,,,I,,I,,
TRAINING,W,Y,N,F,11826281,4,10198294,some porcupines have Sarp teeth and some have small teeth,2225,859,,,,0,0,,,,,,,,
TRAINING,W,Y,N,F,11826285,4,10198295,They'r teeth are like that becuase they never ware out.,859,2225,,,,0,0,,,,,,,,
TRAINING,B,N,N,F,11826653,4,10198287,to eat WOOD,2225,71,,,,0,0,,,,,,,,
TRAINING,A,N,N,M,11826722,4,10198288,"Porcupines can not wear out its teeth, they can scarpe off bark and then they eat the tender woody parts of the wood. During summer they eat twigs, fruitgrass, clovers and dandelions.",2225,148,,,,1,1,,,,,,,,
TRAINING,A,N,N,M,11845493,4,10198298,there teeth grows and they don't ever wear out.,2225,244,744,,,0,1,0,,,,,,,
TRAINING,H,N,N,M,11845510,4,10198297,so they can eat bark,2225,244,,,,0,0,,,,,,,,
TRAINING,W,N,N,F,11971286,4,10198318,I think that porcupines have teeth like that so that they can grind up food better.,2225,148,,,,0,0,,,,,,,,
TRAINING,H,N,N,M,12018507,4,10198308,FDFGTFRHGFD,2225,65,,,,,,,,,I,I,,,
TRAINING,B,Y,N,M,12018879,4,10198307,abcdefghijklmnop,93,2225,,,,,,,,,I,I,,,
TRAINING,H,N,N,M,12063813,4,10198327,"The porcupine has that kind of teeth for many reasons.First, the porcupine gnaws on wood.Next,in the winter porcupines use their big front teeth to scrape off bark.Then they eat the tender woody parts of shrubs and trees.Then,in warmer months porcupines snip off twigs and eat new buds and leaves.In conclusion,that is why porcupines have those teeth.",2225,65,,,,2,2,,,,,,,,
TRAINING,H,Y,N,M,12064077,4,10198330,The porcupines prickly porcupines wear quill-filled coats.,71,65,729,,716,0,,0,,0,,I,,,
TRAINING,A,N,N,F,12063822,4,10198331,jasddxxc,2225,65,,,,,,,,,I,I,,,
TRAINING,W,N,N,F,12149533,4,10198340,I think that porcupines have the kind if teeth that they do because this is what helps them eat.Since their natural diet is of bark and leaves porcupines will need their teeth to get the tender wood underneath the bark.,93,65,729,,,1,2,1,,,,,,,
TRAINING,B,Y,N,F,99318,4,10195026,teeth is strong,2225,65,,,,0,0,,,,,,,,
TRAINING,B,Y,N,M,1744196,4,10196119,They onley have fore teeth becuse they are iseks.,124,148,,,,0,0,,,,,,,,
TRAINING,B,Y,N,M,341238,4,10195312,porcuping share in,2225,859,,,,0,0,,,,,,,,
TRAINING,W,N,N,F,100367,4,10195109,the porcupine tries warning with sound it shivers all over then lightly closes his jaws that makes its top and bottem teeth c-l-a-t-t-e-r together the sound is soft but scary lasting up to thirty seconds at a time if necessary the porcupine repeats it again and again sometimes sight and sounds warnings fail then the porcupine tries communicating thogh smell- a special oder it makes only when threnyenend.,2225,65,729,,,2,0,0,,,,,,,
TRAINING,H,N,Y,F,99983,4,10195007,"The too top and the bootam are stronger.there teeth grow for its hole life. In the winter porcupines us there front teeth to scrap bark.Porcupines use a set flatter teeth,called cheek teeth.",2225,244,729,,,1,2,0,,,,,,,
TRAINING,W,N,N,M,450069,4,10195164,They have those kind of teeth for gnawing on wood and leaves.,2225,65,,,,0,0,,,,,,,,
TRAINING,W,Y,N,M,9583669,4,10198072,For gnawing.,2225,244,,,,0,0,,,,,,,,
TRAINING,W,N,N,M,449786,4,10195152,they are rodents and they need gnaw on trees and evergreens,2225,148,,,,1,1,,,,,,,,
TRAINING,W,N,N,M,450170,4,10195181,"It's easy to gnaw wood, with porcupine teeth. The front pairs-top and bottom-are strong and sharp. A tough orange coating protect thier outer surface. As the porcupine gnaws, it sharpens there teeth by wearing away the backs faster than the fronts, Because the teeth grow for its whole life,they don't ever wear out.",156,2225,,,,0,0,,,,,,,,
TRAINING,W,N,N,M,450171,4,10195184,To help them from predotors that try to kill them for food.,2225,71,,,,0,0,,,,,,,,
TRAINING,W,N,N,M,450212,4,10195178,"as the porcupine gnaws,it sharpens these teeth by wearing away the backs faster than the fronts.Because the teeth grow for its whole lifem,they dont ever wear out.",2225,65,,,,0,0,,,,,,,,
TRAINING,W,N,N,M,450216,4,10195166,For eating and scaring predators away. Also for getting good food for thier youngs.,2225,71,,,,0,0,,,,,,,,
TRAINING,W,N,Y,F,451915,4,10194799,animals with four front teeth built especially for gnawing.,244,2225,,,,0,0,,,,,,,,
TRAINING,H,N,N,F,708334,4,10195716,They have those teeth because they use them to make a c-l-a-t-t-e-r sound to warn pretors to stay a way from them.,2225,244,,,,1,1,,,,,,,,
TRAINING,W,N,N,F,451996,4,10194801,They probably have the teeth like that so they can shew bark and so they can peel the bark off the tree. Also so they can nibble needles on evergreens.,2225,859,,,,1,1,,,,,,,,
TRAINING,W,N,N,M,708337,4,10195719,to gnaw on wood and clatter there teeth,93,148,,,,0,0,,,,,,,,
TRAINING,W,Y,N,M,451437,4,10194805,They have flat teeth so they can chatter together.,2225,148,729,,,0,1,0,,,,,,,
TRAINING,W,Y,N,M,710603,4,10195692,wow,2225,65,,,,,,,,,I,I,,,
TRAINING,W,N,N,F,710484,4,10195703,to gnaw on wood.,93,65,,,,0,0,,,,,,,,
TRAINING,W,N,N,M,664351,4,10195454,That porcupines can posibly eat bark like how beaver do or that porcupines are not the strongest animal in the world.,2225,859,,,,0,0,,,,,,,,
TRAINING,W,N,N,M,711763,4,10195685,?????,2225,244,,,,,,,,,I,I,,,
TRAINING,W,N,N,F,1745190,4,10196130,"Porcupines have the kind of teeth they do because they help the porcupine chew through the wood that they eat, and wood has bark so they will help get the bark off. The teeth are also why th porcupine is a rodent. Their sharp teeth make it easy to gnaw food or wood. Theres alot of things that a porcupine can eat so the teeth they have make it much easier.",93,148,744,,,1,2,2,,,,,,,
TRAINING,W,N,N,F,1745247,4,10196135,To protect them,2225,148,,,,0,0,,,,,,,,
TRAINING,H,N,Y,M,2010804,4,10196201,porcupines hav strang tiythe becus thay eyt a veriyatey of things that thay eyt.,71,244,,,,0,0,,,,,,,,
TRAINING,W,Y,N,M,2010740,4,10196206,"They eat wood and they have yelow teeth, their teeth are grooooose and ther theeth might have turmights because of all the wood it ate.",2225,148,,,,0,0,,,,,,,,
TRAINING,2,N,N,M,1400685,4,10195568,[khnj;ljmkjjjinojnojnjnl;n jknoijjoijh,2225,65,,,,,,,,,I,I,,,
TRAINING,W,N,N,F,1400096,4,10195566,dhfgFJSHFJSHFHgahghgagvnastu,2225,65,,,,,,,,,I,I,,,
TRAINING,W,Y,N,F,2011744,4,10196189,They keep the tee th clean because it is hethey for them .,2225,244,,,,0,0,,,,,,,,
TRAINING,W,N,N,M,9352210,4,10198084,??????????????????????????????????????????????????????????????????????????????????????????????????????????????????????.,2225,65,,,,,,,,,I,I,,,
TRAINING,W,N,N,M,2216442,4,10196234,Porcupines are guessed to be rodents because of the teeth that never stop growing.,2225,148,744,,,0,1,1,,,,,,,
TRAINING,W,N,N,F,2216448,4,10196231,there teeth never wear out,2225,244,,,,0,0,,,,,,,,
TRAINING,W,N,N,M,2012724,4,10196194,Porcpines have bid teeth because so they can scrape of bark for food.,244,2225,729,,,1,0,1,,,,,,,
TRAINING,W,Y,N,M,8699220,4,10196944,shrip teeth,2225,244,,,,0,0,,,,,,,,
TRAINING,W,N,N,M,2217687,4,10196244,They have that kind of teeth because they are plant eaters.,93,564,,,,0,0,,,,,,,,
TRAINING,W,Y,N,M,8699494,4,10196946,I brush my teeth after berefest an after super.,2225,65,729,,,0,,,,,,I,I,,
TRAINING,W,Y,N,M,3933251,4,10196291,It uses a flat set of teath.,564,93,,,,0,0,,,,,,,,
TRAINING,H,N,N,F,8699620,4,10196948,"Porkupines use their big teeth in winter to scrape off bark from trees to eat in winter. porkupines also need strong teeth to eat apples, and twigs. They use their teeth to grind up food. A porkupine's teeth never wear out. This is beacause they have an orange coating on their teeth to protect their teeth.",564,2225,,,,1,1,,,,,,,,
TRAINING,W,N,N,F,8700200,4,10196958,Porkupines have 4 frunt teeth and they are called rodents and there not a pig. Pork is meet and one tipe of meet is pig. Pine seems sharp and dangers beacause they are dangeres. So that is what I dont get and things I do get.,124,564,,,,0,0,,,,,,,,
TRAINING,W,N,N,M,8702282,4,10198055,To eat twigs and bark.,2225,65,,,,0,0,,,,,,,,
TRAINING,W,N,N,M,9352377,4,10198088,The front pairs-- top and bottom-- are strong and sharp.,2225,859,,,,0,0,,,,,,,,
TRAINING,W,N,N,F,8702435,4,10198043,The porcupines have two top teeth and two bottom teeth in the front.,2225,148,,,,0,0,,,,,,,,
TRAINING,W,N,N,M,8704894,4,10196878,So they can eat bark and leves,2225,65,,,,0,0,,,,,,,,
TRAINING,NR,N,N,F,5412239,4,10196387,"Porcupines have those kind of teeth to help them gnaw on trees and pines. Like beavers, they only have four front teeth two at the bottom and two at the top.",564,65,,,,0,0,,,,,,,,
TRAINING,W,N,N,M,5413126,4,10196409,They possibly have the type of teeth they do because they have adapted,71,2225,,,,0,0,,,,,,,,
TRAINING,W,N,N,M,7494722,4,10196732,TEETH ARE INPORTEN,124,148,,,,0,0,,,,,,,,
TRAINING,W,N,N,F,7616852,4,10196744,porcupines are spiney anials that have four fron teeth that they use for gnawing,2225,244,,,,0,0,,,,,,,,
TRAINING,A,N,N,M,7497712,4,10196840,thay nead to eat buds frum stiks,2225,65,,,,0,0,,,,,,,,
TRAINING,W,N,N,F,7619717,4,10196782,That north amaricens alegle imingrents.They didn't know what to do.,2225,148,,,,,,,,,I,I,,,
TRAINING,W,N,N,F,8698653,4,10197001,porcupines have teeth like they do because that is how they were born.,2225,65,,,,0,0,,,,,,,,
TRAINING,W,N,N,F,9801374,4,10198139,They use their teeth to warn their enemies or even people for that matter!,93,244,,,,0,0,,,,,,,,
TRAINING,W,N,N,F,10385818,4,10198192,Porcupines need these teeth for eating and making the sound to keep harming things away from them.,2225,65,729,,,1,0,0,,,,,,,
TRAINING,H,N,N,M,11524235,4,10198250,They have that kind of teeth because they need it to eat and scrape of bark!,2225,244,,,,0,0,,,,,,,,
TRAINING,W,N,N,F,11495599,4,10198241,Well there teth are verry strong so they can cit into broken bark and eat leftover bark from beavers and humans can not bite into bark so to me that is really strong.,244,2225,744,,,1,0,1,,,,,,,
TRAINING,B,N,N,F,11825271,4,10198285,well when i read this story it was like im in there.,124,65,744,,716,0,,,,,,I,I,,I
TRAINING,B,N,N,F,11844291,4,10198302,"Teeth are kind of special .You need teeth so that you can eat with them ,brush them,kind of talk with them. Porcupines teeth are easy to gnaw wood. The front teeth- top and bottom- are strong and sharp. A tough orange coating protects their otter surface. As the porcupines gnaw, it sharpens these teeth by wearing away the back faster than the fronts. Because the teeth grows for its whole life, they don't even wear out. During winter, porcupines use their big front teeth to scrape off bark.",2225,244,729,,,1,2,2,,,,,,,
TRAINING,W,N,N,M,12149321,4,10198342,2,564,2225,,,,,,,,,I,I,,,
TRAINING,W,N,N,M,12178034,4,10198348,PORCUPINES HAVE THE TEETH THAT THEY DO BECAUSE THEY NEED TO EAT AND SOME OF THE STUFF THAT THEY EAT IS really HARD,564,93,744,,,0,1,0,,,,,,,
TRAINING,W,N,N,M,342887,4,10192391,"Porcupines have sharp theeth so they can nibble on any thing , or eat any thing.",124,2225,,,,0,0,,,,,,,,
TRAINING,W,N,N,M,450780,4,10195215,Then the porcupine tries communicating through smell-a special odor it makes only when threatened.,564,93,,,,0,0,,,,,,,,
TRAINING,W,N,N,M,539380,4,10195274,they have them to eat.,65,2225,,,,0,0,,,,,,,,
TRAINING,W,N,N,M,539460,4,10195268,"Thre front teeth are for gnawing. Like for rodents like mice, squirrels and beavers.",156,2225,,,,0,0,,,,,,,,
TRAINING,W,N,N,F,3942333,4,10196306,So they could be ready for attack.,2225,65,,,,0,0,,,,,,,,
TRAINING,W,N,N,F,3942734,4,10196308,They are used to knaw on things like wood.,2225,244,,,,0,0,,,,,,,,
TRAINING,W,Y,N,M,3942146,4,10196307,the kind of teeth that they do use,2225,65,,,,0,0,,,,,,,,
TRAINING,W,N,N,F,11844592,4,10198299,The bottom teeth can comcent together.,564,2225,,,,0,0,,,,,,,,
TRAINING,W,N,N,F,11971829,4,10198322,they use their teeth for eating.,2225,244,,,,0,0,,,,,,,,
TRAINING,W,N,N,M,11971886,4,10198319,so they can worn enimes,564,93,,,,0,0,,,,,,,,
TRAINING,W,N,N,F,2011378,4,10196183,"The reason that they have the teeth they do is because during the winter ,porcupines use there big front teeth to scape off bark.",2225,65,,,,0,0,,,,,,,,
TRAINING,W,N,N,M,11825514,4,10198292,The world,564,65,,,,,,,,,I,I,,,
VALIDATION,NR,Y,N,M,3439138,4,12312835,IT MAKES IT SO THERE TEETH CLATTER,,,,,,,,,,,,,,,
VALIDATION,H,N,N,F,95975,4,12312595,They have sharp teeth so if a animal ignores the effects the porcipine is doing it will get bit and porcipines have sharp teeth so the food they eat will be easy to chew.,,,,,,,,,,,,,,,
VALIDATION,H,N,Y,F,96461,4,12312594,they do not have sharp teeth like other animamls,,,,,,,,,,,,,,,
VALIDATION,W,N,N,F,4350924,4,12312858,Porcupines have strong and sharp teeth so they are able to chew on trees to make them fall down.,,,,,,,,,,,,,,,
VALIDATION,W,N,N,F,165336,4,12312608,"A porcupines teeth have many uses.it's easy to gnaw on wood,because the front pairs-top and bottem-are strong and sharp.they are also used to warn off predaters.It does this by shivering its body and closing its jaw together.It makes a soft but scary clatter and last up to 30 minutes each time.",,,,,,,,,,,,,,,
VALIDATION,H,N,N,M,166762,4,12312609,They have front teeth like rodents that is why they have big teeth like they do .Also they can gnaw on wood.,,,,,,,,,,,,,,,
VALIDATION,W,N,N,M,448855,4,12312643,strong and togh,,,,,,,,,,,,,,,
VALIDATION,A,N,N,F,209657,4,12312621,"I think the porcupine have the teeth they have because, it's easy for the porcupines to chomp on wood, and nibble on hard bark because, their teeth grow back and if the porcupine chews, nibbles, munches, or gnaws on wood their teeth grow shorter so, their teeth won't be that long.",,,,,,,,,,,,,,,
VALIDATION,W,N,N,F,209835,4,12312610,i think that they have the teeth they do because they need to knaw on the wood to get food from it.,,,,,,,,,,,,,,,
VALIDATION,H,N,N,F,1744162,4,12312786,I think that the four front teeth that a porcupine has could be used especialy used for Gnawing because the teeth that are in the front are stronger. Since there are four teeth the front teeth will be even stronger.,,,,,,,,,,,,,,,
VALIDATION,W,N,N,F,99030,4,12312637,They have cheek teeth to grind up food and the teeth have a gap between these teeth so in the winter thecold air does not come in.,,,,,,,,,,,,,,,
VALIDATION,W,N,N,F,209374,4,12312615,"I think that the porcupines have the teeth that they do because, when you chew on the bark from the trees your teeth might get sharper. Also, When you rub your teeth back and forth it will make them sharper and stronger. That is why I think pocupines have teeth like they do.",,,,,,,,,,,,,,,
VALIDATION,H,N,N,M,99422,4,12312638,porcupines have the the kind of teeth that they haver to knaw there food,,,,,,,,,,,,,,,
VALIDATION,H,N,N,F,1744163,4,12312787,"An inference that I can make is,porcupines have big teeth they use thair teeth to scrape of bark . Then they eat the ten der woody parts of shrubs and trees.",,,,,,,,,,,,,,,
VALIDATION,H,N,N,F,209775,4,12312616,"porcupines use there teeth for many things like scrape of bark,gnaw wood and eat the tender woody parts of shrubs and trees.",,,,,,,,,,,,,,,
VALIDATION,W,N,N,F,209862,4,12312618,Its easyer fo them to knaw would and they eat tender parts of wood. They alsoe snip off peices of buds and leaves to eat.,,,,,,,,,,,,,,,
VALIDATION,2,N,N,M,1029966,4,12312730,the have speasol teeth that helps them cut wood and it helps sharpen ther teeth and the teeth dont stop growing.,,,,,,,,,,,,,,,
VALIDATION,W,N,N,M,449328,4,12312644,?,,,,,,,,,,,,,,,
VALIDATION,W,N,N,M,210187,4,12312619,One is so they can chew of a branch to eat the leaves and bark. Also when aonther aniaml is attacking them they use thier teeth to senda scary sound.,,,,,,,,,,,,,,,
VALIDATION,H,N,N,M,210189,4,12312620,They have the teeth they do because they have sharp points,,,,,,,,,,,,,,,
VALIDATION,H,N,N,F,1395926,4,12312747,Porcupines have the kind of teeth that they do because they need to have strong teeth.,,,,,,,,,,,,,,,
VALIDATION,H,N,Y,M,99249,4,12312640,In World Full of Food it Said'' porcupine eatbut they s fruit especially apples but they usually toss away cores,,,,,,,,,,,,,,,
VALIDATION,W,N,N,F,210831,4,12312611,I think porcupines have sharp teeth so the porcupine get food faster and easier. The sharp front teeth help them get food in the winter (finding food in the winter is hard) so porcupines can live year round.,,,,,,,,,,,,,,,
VALIDATION,B,N,N,M,448957,4,12312655,They have that type of teeth because they use for choping up wood to eat,,,,,,,,,,,,,,,
VALIDATION,W,N,N,F,99903,4,12312634,"I can infer that the porcupines teeth are for eating food that is hard. I say this because the author says in the winter they eat bark in the winter, and it is hard for a human to do that. I also say this because their teeth can make a clatter sound to scare off other things that are annoying , scary, or in its &quot;property&quot;. I think their teeth have many uses. They are special teeth!",,,,,,,,,,,,,,,
VALIDATION,W,N,N,F,99905,4,12312635,I think that porcupines have teeth that they do because they need them to do the c-l-a-t-t-e-r sound and because they need to gnaw on wood to keep their teeth sharp and they also need their teeth to eat hard typs of food.,,,,,,,,,,,,,,,
VALIDATION,H,N,N,F,211230,4,12312613,I don't now the anser for this.,,,,,,,,,,,,,,,
VALIDATION,H,N,N,F,210539,4,12312614,"Porcupines have strong and sharp teeth so its easy to gnaw wood with their teeth.When the porcupine gnaws,the teeth sharpen by carrying away the backs faster than its fronts.",,,,,,,,,,,,,,,
VALIDATION,H,N,N,F,210909,4,12312629,Porccupines have teeth like they do beacause it helps them chew and eat their food.In the story it says they have strong and sharp teeth and in the back bottom front and top.,,,,,,,,,,,,,,,
VALIDATION,W,N,N,M,341101,4,12312668,"They have the teeth that they do because in the text it said the front pairs top and bottom are strong and sharp.Their teeth never stop growing but they wear out their teeth by gnawing at bark,and eat wood and they have a set of flatter teeth also known as cheek teeth to grind up food.So I think that porcupines have strong sharp teeth and their teeth never stop growing kind of like a hamster",,,,,,,,,,,,,,,
VALIDATION,B,N,N,F,211783,4,12312622,Porcupine's teeth can be different sizes and weird,,,,,,,,,,,,,,,
VALIDATION,B,N,N,F,211489,4,12312624,the prickly wear filled coats no wonder there called pricklepigs,,,,,,,,,,,,,,,
VALIDATION,W,N,N,M,449176,4,12312645,I assume porkupines have big teeth scince the passege say their teeth never stop growing.,,,,,,,,,,,,,,,
